{
  "decisionRecordSchemaVersion": "alto9.io/policy-decision-record/v1alpha1",
  "packName": "production-infra-baseline",
  "packVersion": "1.0.0",
  "fixtureId": "cf-terraform-prod-network-boundary",
  "toolFamily": "terraform",
  "matchedRules": [
    {
      "ruleId": "require-approval-prod-network-boundary-change",
      "category": "network-boundary",
      "decision": "require_approval",
      "severity": "high",
      "riskLevel": "high",
      "reason": "Production network boundary changes can expose internal systems.",
      "riskSummary": "Network boundary changes can expose internal systems to broader ingress or routing risk.",
      "changeTypes": [
        "security-group-ingress-expanded"
      ],
      "classifierLabels": [
        "security-group-ingress-expanded"
      ],
      "resourceIdentity": "aws_security_group.web",
      "evidenceReferences": [
        {
          "kind": "envelope",
          "path": "inputs/terraform/prod-network-boundary-envelope.json"
        },
        {
          "kind": "artifact",
          "path": "inputs/terraform/prod-network-boundary-plan.json"
        },
        {
          "kind": "policyDocument",
          "digest": "sha256:7b06cb981615373e33b41a16cfa7d2f78bae52ce7e5ab542703a80ddeffff385",
          "ruleId": "require-approval-prod-network-boundary-change"
        },
        {
          "kind": "fixtureCase",
          "path": "classifier-cases.json#cf-terraform-prod-network-boundary"
        }
      ]
    }
  ],
  "parserLimitations": []
}
