{
  "decisionRecordSchemaVersion": "alto9.io/policy-decision-record/v1alpha1",
  "packName": "production-infra-baseline",
  "packVersion": "1.0.0",
  "fixtureId": "cf-terraform-secrets-hint",
  "toolFamily": "terraform",
  "matchedRules": [
    {
      "ruleId": "require-approval-secrets-exposure-hint",
      "category": "secrets-exposure-hint",
      "decision": "require_approval",
      "severity": "high",
      "riskLevel": "high",
      "reason": "Possible secret material appeared in plan, template, diff, or command output.",
      "riskSummary": "Possible secret material in artifacts; review before proceed to avoid credential leakage.",
      "changeTypes": [
        "secret-value-in-plan"
      ],
      "classifierLabels": [
        "secret-value-in-plan"
      ],
      "resourceIdentity": "aws_secretsmanager_secret_version.app",
      "evidenceReferences": [
        {
          "kind": "envelope",
          "path": "inputs/terraform/secrets-hint-envelope.json"
        },
        {
          "kind": "artifact",
          "path": "inputs/terraform/secrets-hint-plan.json"
        },
        {
          "kind": "policyDocument",
          "digest": "sha256:7b06cb981615373e33b41a16cfa7d2f78bae52ce7e5ab542703a80ddeffff385",
          "ruleId": "require-approval-secrets-exposure-hint"
        },
        {
          "kind": "fixtureCase",
          "path": "classifier-cases.json#cf-terraform-secrets-hint"
        }
      ]
    }
  ],
  "parserLimitations": []
}
