{
  "decisionRecordSchemaVersion": "alto9.io/policy-decision-record/v1alpha1",
  "packName": "production-infra-baseline",
  "packVersion": "1.0.0",
  "fixtureId": "cf-cdk-prod-new-role",
  "toolFamily": "cdk",
  "matchedRules": [
    {
      "ruleId": "require-approval-prod-new-role",
      "category": "new-role",
      "decision": "require_approval",
      "severity": "high",
      "riskLevel": "high",
      "reason": "New or materially changed production roles change who can act in the account.",
      "riskSummary": "Introduces or changes production role identities and trust relationships.",
      "changeTypes": [
        "new-role"
      ],
      "classifierLabels": [
        "new-role"
      ],
      "resourceIdentity": "BatchWorkerRole",
      "evidenceReferences": [
        {
          "kind": "envelope",
          "path": "inputs/cdk/prod-new-role-envelope.json"
        },
        {
          "kind": "artifact",
          "path": "inputs/cdk/prod-iam-role-template.json"
        },
        {
          "kind": "policyDocument",
          "digest": "sha256:7b06cb981615373e33b41a16cfa7d2f78bae52ce7e5ab542703a80ddeffff385",
          "ruleId": "require-approval-prod-new-role"
        },
        {
          "kind": "fixtureCase",
          "path": "classifier-cases.json#cf-cdk-prod-new-role"
        }
      ]
    }
  ],
  "parserLimitations": []
}
