{
  "decisionRecordSchemaVersion": "alto9.io/policy-decision-record/v1alpha1",
  "packName": "production-infra-baseline",
  "packVersion": "1.0.0",
  "fixtureId": "cf-terraform-cost-threshold",
  "toolFamily": "terraform",
  "matchedRules": [
    {
      "ruleId": "observe-cost-threshold-breach",
      "category": "cost-threshold",
      "decision": "observe",
      "severity": "medium",
      "riskLevel": "medium",
      "reason": "Estimated cost impact exceeded the configured threshold for this change.",
      "riskSummary": "Estimated cost or budget threshold exceeded; recorded for finance and platform review.",
      "changeTypes": [
        "budget-threshold-exceeded"
      ],
      "classifierLabels": [
        "budget-threshold-exceeded"
      ],
      "resourceIdentity": "aws_instance.analytics",
      "evidenceReferences": [
        {
          "kind": "envelope",
          "path": "inputs/terraform/cost-threshold-envelope.json"
        },
        {
          "kind": "artifact",
          "path": "inputs/terraform/cost-threshold-plan.json"
        },
        {
          "kind": "policyDocument",
          "digest": "sha256:7b06cb981615373e33b41a16cfa7d2f78bae52ce7e5ab542703a80ddeffff385",
          "ruleId": "observe-cost-threshold-breach"
        },
        {
          "kind": "fixtureCase",
          "path": "classifier-cases.json#cf-terraform-cost-threshold"
        }
      ]
    }
  ],
  "parserLimitations": []
}
